topic,context
Computer Science,"Program execution might be likened to reading a book. While a person will normally read each word and line in sequence, they may at times jump back to an earlier place in the text or skip sections that are not of interest. Similarly, a computer may sometimes go back and repeat the instructions in some section of the program over and over again until some internal condition is met. This is called the flow of control within the program and it is what allows the computer to perform tasks repeatedly without human intervention."
Computer Science,"Desktop computers and laptops are commonly infected with malware either to gather passwords or financial account information, or to construct a botnet to attack another target. Smart phones, tablet computers, smart watches, and other mobile devices such as Quantified Self devices like activity trackers have also become targets and many of these have sensors such as cameras, microphones, GPS receivers, compasses, and accelerometers which could be exploited, and may collect personal information, including sensitive health information. Wifi, Bluetooth, and cell phone network on any of these devices could be used as attack vectors, and sensors might be remotely activated after a successful breach."
Computer Science,"Windows 8 was released to a mixed critical reception. Although reaction towards its performance improvements, security enhancements, and improved support for touchscreen devices was positive, the new user interface of the operating system was widely criticized for being potentially confusing and difficult to learn (especially when used with a keyboard and mouse instead of a touchscreen). Despite these shortcomings, 60 million Windows 8 licenses have been sold through January 2013, a number which included both upgrades and sales to OEMs for new PCs."
Computer Science,"ASCII (i/ËˆÃ¦ski/ ASS-kee), abbreviated from American Standard Code for Information Interchange, is a character-encoding scheme (the IANA prefers the name US-ASCII). ASCII codes represent text in computers, communications equipment, and other devices that use text. Most modern character-encoding schemes are based on ASCII, though they support many additional characters. ASCII was the most common character encoding on the World Wide Web until December 2007, when it was surpassed by UTF-8, which is fully backward compatibe to ASCII."
Computer Science,"In UTF-32 and UCS-4, one 32-bit code value serves as a fairly direct representation of any character's code point (although the endianness, which varies across different platforms, affects how the code value manifests as an octet sequence). In the other encodings, each code point may be represented by a variable number of code values. UTF-32 is widely used as an internal representation of text in programs (as opposed to stored or transmitted text), since every Unix operating system that uses the gcc compilers to generate software uses it as the standard ""wide character"" encoding. Some programming languages, such as Seed7, use UTF-32 as internal representation for strings and characters. Recent versions of the Python programming language (beginning with 2.2) may also be configured to use UTF-32 as the representation for Unicode strings, effectively disseminating such encoding in high-level coded software."
Computer Science,"In 2012, Fortune ranked IBM the second largest U.S. firm in terms of number of employees (435,000 worldwide), the fourth largest in terms of market capitalization, the ninth most profitable, and the nineteenth largest firm in terms of revenue. Globally, the company was ranked the 31st largest in terms of revenue by Forbes for 2011. Other rankings for 2011/2012 include â„–1 company for leaders (Fortune), â„–1 green company in the United States (Newsweek), â„–2 best global brand (Interbrand), â„–2 most respected company (Barron's), â„–5 most admired company (Fortune), and â„–18 most innovative company (Fast Company)."
Computer Science,"A USB packet's end, called EOP (end-of-packet), is indicated by the transmitter driving 2 bit times of SE0 (D+ and Dâˆ’ both below max.) and 1 bit time of J state. After this, the transmitter ceases to drive the D+/Dâˆ’ lines and the aforementioned pull up resistors hold it in the J (idle) state. Sometimes skew due to hubs can add as much as one bit time before the SE0 of the end of packet. This extra bit can also result in a ""bit stuff violation"" if the six bits before it in the CRC are 1s. This bit should be ignored by receiver."
Computer Science,"If the data to be compressed is analog (such as a voltage that varies with time), quantization is employed to digitize it into numbers (normally integers). This is referred to as analog-to-digital (A/D) conversion. If the integers generated by quantization are 8 bits each, then the entire range of the analog signal is divided into 256 intervals and all the signal values within an interval are quantized to the same number. If 16-bit integers are generated, then the range of the analog signal is divided into 65,536 intervals."
Computer Science,"Non-standard bit rates up to 640 kbit/s can be achieved with the LAME encoder and the freeformat option, although few MP3 players can play those files. According to the ISO standard, decoders are only required to be able to decode streams up to 320 kbit/s."
Computer Science,"Sometimes it is desired to bring a database back to a previous state (for many reasons, e.g., cases when the database is found corrupted due to a software error, or if it has been updated with erroneous data). To achieve this a backup operation is done occasionally or continuously, where each desired database state (i.e., the values of its data and their embedding in database's data structures) is kept within dedicated backup files (many techniques exist to do this effectively). When this state is needed, i.e., when it is decided by a database administrator to bring the database back to this state (e.g., by specifying this state by a desired point in time when the database was in this state), these files are utilized to restore that state."
Biology,"The genome size, and the number of genes it encodes varies widely between organisms. The smallest genomes occur in viruses (which can have as few as 2 protein-coding genes), and viroids (which act as a single non-coding RNA gene). Conversely, plants can have extremely large genomes, with rice containing >46,000 protein-coding genes. The total number of protein-coding genes (the Earth's proteome) is estimated to be 5 million sequences."
Biology,"Symbiosis (from Greek ÏƒÏÎ½ ""together"" and Î²Î¯Ï‰ÏƒÎ¹Ï‚ ""living"") is close and often long-term interaction between two different biological species. In 1877 Albert Bernhard Frank used the word symbiosis (which previously had been used to depict people living together in community) to describe the mutualistic relationship in lichens. In 1879, the German mycologist Heinrich Anton de Bary defined it as ""the living together of unlike organisms."""
Biology,"Interactions between alcohol and certain antibiotics may occur and may cause side-effects and decreased effectiveness of antibiotic therapy. While moderate alcohol consumption is unlikely to interfere with many common antibiotics, there are specific types of antibiotics with which alcohol consumption may cause serious side-effects. Therefore, potential risks of side-effects and effectiveness depend on the type of antibiotic administered. Despite the lack of a categorical counterindication, the belief that alcohol and antibiotics should never be mixed is widespread."
Biology,"Interspecific crop diversity is, in part, responsible for offering variety in what we eat. Intraspecific diversity, the variety of alleles within a single species, also offers us choice in our diets. If a crop fails in a monoculture, we rely on agricultural diversity to replant the land with something new. If a wheat crop is destroyed by a pest we may plant a hardier variety of wheat the next year, relying on intraspecific diversity. We may forgo wheat production in that area and plant a different species altogether, relying on interspecific diversity. Even an agricultural society which primarily grows monocultures, relies on biodiversity at some point."
Biology,"The brain is an organ that serves as the center of the nervous system in all vertebrate and most invertebrate animals. Only a few invertebrates such as sponges, jellyfish, adult sea squirts and starfish do not have a brain; diffuse or localised nerve nets are present instead. The brain is located in the head, usually close to the primary sensory organs for such senses as vision, hearing, balance, taste, and smell. The brain is the most complex organ in a vertebrate's body. In a typical human, the cerebral cortex (the largest part) is estimated to contain 15â“33 billion neurons, each connected by synapses to several thousand other neurons. These neurons communicate with one another by means of long protoplasmic fibers called axons, which carry trains of signal pulses called action potentials to distant parts of the brain or body targeting specific recipient cells."
Biology,"Resistance to infection (immunity) may be acquired following a disease, by asymptomatic carriage of the pathogen, by harboring an organism with a similar structure (crossreacting), or by vaccination. Knowledge of the protective antigens and specific acquired host immune factors is more complete for primary pathogens than for opportunistic pathogens. There is also the phenomenon of herd immunity which offers a measure of protection to those otherwise vulnerable people when a large enough proportion of the population has acquired immunity from certain infections."
Biology,"Regardless of the type of metabolic process they employ, the majority of bacteria are able to take in raw materials only in the form of relatively small molecules, which enter the cell by diffusion or through molecular channels in cell membranes. The Planctomycetes are the exception (as they are in possessing membranes around their nuclear material). It has recently been shown that Gemmata obscuriglobus is able to take in large molecules via a process that in some ways resembles endocytosis, the process used by eukaryotic cells to engulf external items."
Biology,"In modern molecular biology and genetics, the genome is the genetic material of an organism. It consists of DNA (or RNA in RNA viruses). The genome includes both the genes and the non-coding sequences of the DNA/RNA."
Biology,"The humoral (antibody) response is defined as the interaction between antibodies and antigens. Antibodies are specific proteins released from a certain class of immune cells known as B lymphocytes, while antigens are defined as anything that elicits the generation of antibodies (""anti""body ""gen""erators). Immunology rests on an understanding of the properties of these two biological entities and the cellular response to both."
Biology,"Antibiotics revolutionized medicine in the 20th century, and have together with vaccination led to the near eradication of diseases such as tuberculosis in the developed world. Their effectiveness and easy access led to overuse, especially in livestock raising, prompting bacteria to develop resistance. This has led to widespread problems with antimicrobial and antibiotic resistance, so much as to prompt the World Health Organization to classify antimicrobial resistance as a ""serious threat [that] is no longer a prediction for the future, it is happening right now in every region of the world and has the potential to affect anyone, of any age, in any country""."
Physics,"A solar balloon is a black balloon that is filled with ordinary air. As sunlight shines on the balloon, the air inside is heated and expands causing an upward buoyancy force, much like an artificially heated hot air balloon. Some solar balloons are large enough for human flight, but usage is generally limited to the toy market as the surface-area to payload-weight ratio is relatively high."
Physics,"Examples of energy transformation include generating electric energy from heat energy via a steam turbine, or lifting an object against gravity using electrical energy driving a crane motor. Lifting against gravity performs mechanical work on the object and stores gravitational potential energy in the object. If the object falls to the ground, gravity does mechanical work on the object which transforms the potential energy in the gravitational field to the kinetic energy released as heat on impact with the ground. Our Sun transforms nuclear potential energy to other forms of energy; its total mass does not decrease due to that in itself (since it still contains the same total energy even if in different forms), but its mass does decrease when the energy escapes out to its surroundings, largely as radiant energy."
Physics,"In recent years light emitting diodes (LEDs) are becoming increasingly efficient leading to an extraordinary increase in the use of solid state lighting. In many situations, controlling the light emission of LEDs may be done most effectively by using the principles of nonimaging optics."
Physics,"A very small amount of water vapor inside a light bulb can significantly affect lamp darkening. Water vapor dissociates into hydrogen and oxygen at the hot filament. The oxygen attacks the tungsten metal, and the resulting tungsten oxide particles travel to cooler parts of the lamp. Hydrogen from water vapor reduces the oxide, reforming water vapor and continuing this water cycle. The equivalent of a drop of water distributed over 500,000 lamps will significantly increase darkening. Small amounts of substances such as zirconium are placed within the lamp as a getter to react with any oxygen that may bake out of the lamp components during operation."
Physics,"For maximum life, capacitors usually need to be able to handle the maximum amount of reversal that a system will experience. An AC circuit will experience 100% voltage reversal, while under-damped DC circuits will experience less than 100%. Reversal creates excess electric fields in the dielectric, causes excess heating of both the dielectric and the conductors, and can dramatically shorten the life expectancy of the capacitor. Reversal ratings will often affect the design considerations for the capacitor, from the choice of dielectric materials and voltage ratings to the types of internal connections used."
Physics,"The development of quadraphonic records was announced in 1971. These recorded four separate sound signals. This was achieved on the two stereo channels by electronic matrixing, where the additional channels were combined into the main signal. When the records were played, phase-detection circuits in the amplifiers were able to decode the signals into four separate channels. There were two main systems of matrixed quadraphonic records produced, confusingly named SQ (by CBS) and QS (by Sansui). They proved commercially unsuccessful, but were an important precursor to later surround-sound systems, as seen in SACD and home cinema today."
Physics,"LEDs have also been used as a medium-quality voltage reference in electronic circuits. The forward voltage drop (e.g. about 1.7 V for a normal red LED) can be used instead of a Zener diode in low-voltage regulators. Red LEDs have the flattest I/V curve above the knee. Nitride-based LEDs have a fairly steep I/V curve and are useless for this purpose. Although LED forward voltage is far more current-dependent than a Zener diode, Zener diodes with breakdown voltages below 3 V are not widely available."
Physics,"In weak basic solutions containing Zn2+ ions, the hydroxide Zn(OH)2 forms as a white precipitate. In stronger alkaline solutions, this hydroxide is dissolved to form zincates ([Zn(OH)4]2âˆ’). The nitrate Zn(NO3)2, chlorate Zn(ClO3)2, sulfate ZnSO4, phosphate Zn3(PO4)2, molybdate ZnMoO4, cyanide Zn(CN)2, arsenite Zn(AsO2)2, arsenate Zn(AsO4)2Â·8H2O and the chromate ZnCrO4 (one of the few colored zinc compounds) are a few examples of other common inorganic compounds of zinc. One of the simplest examples of an organic compound of zinc is the acetate (Zn(O2CCH3)2)."
Physics,"The Planck constant, or Planck's constant, is a fundamental physical constant of foundational importance in quantum mechanics. The constant gives the relationship between the energy of a photon and its frequency, and by the mass-energy equivalence, the relationship between mass and frequency. Specifically, a photon's energy is equal to its frequency multiplied by the Planck constant."
Physics,"In the absence of atmospheric oxygen (O2), in deep geological conditions prevailing far away from Earth atmosphere, hydrogen (H2) is produced during the process of serpentinization by the anaerobic oxidation by the water protons (H+) of the ferrous (Fe2+) silicate present in the crystal lattice of the fayalite (Fe2SiO4, the olivine iron-endmember). The corresponding reaction leading to the formation of magnetite (Fe3O4), quartz (SiO2) and hydrogen (H2) is the following:"
Physics,"There are two types of transistors, which have slight differences in how they are used in a circuit. A bipolar transistor has terminals labeled base, collector, and emitter. A small current at the base terminal (that is, flowing between the base and the emitter) can control or switch a much larger current between the collector and emitter terminals. For a field-effect transistor, the terminals are labeled gate, source, and drain, and a voltage at the gate can control a current between source and drain."
History,"In 1912, the Republic of China was established and Sun Yat-sen was inaugurated in Nanjing as the first Provisional President. But power in Beijing already had passed to Yuan Shikai, who had effective control of the Beiyang Army, the most powerful military force in China at the time. To prevent civil war and possible foreign intervention from undermining the infant republic, leaders agreed to Army's demand that China be united under a Beijing government. On March 10, in Beijing, Shikai was sworn in as the second Provisional President of the Republic of China."
History,"Throughout most of his career, Athanasius had many detractors. Classical scholar Timothy Barnes relates contemporary allegations against Athanasius: from defiling an altar, to selling Church grain that had been meant to feed the poor for his own personal gain, and even violence and murder to suppress dissent. Athanasius used ""Arian"" to describe both followers of Arius, and as a derogatory polemical term for Christians who disagreed with his formulation of the Trinity. Athanasius called many of his opponents ""Arian"", except for Miletus."
History,"In the words of Labour Member of Parliament George Hardie, the abdication crisis of 1936 did ""more for republicanism than fifty years of propaganda"". George VI wrote to his brother Edward that in the aftermath of the abdication he had reluctantly assumed ""a rocking throne"", and tried ""to make it steady again"". He became king at a point when public faith in the monarchy was at a low ebb. During his reign his people endured the hardships of war, and imperial power was eroded. However, as a dutiful family man and by showing personal courage, he succeeded in restoring the popularity of the monarchy."
History,"The Crimean War marked the ascendancy of France to the position of pre-eminent power on the Continent,:411 the continued decline of the Ottoman Empire, and the beginning of a decline for Tsarist Russia. As Fuller notes, ""Russia had been beaten on the Crimean peninsula, and the military feared that it would inevitably be beaten again unless steps were taken to surmount its military weakness."" The Crimean War marks the demise of the Concert of Europe, the balance of power that had dominated Europe since the Congress of Vienna in 1815, and which had included France, Russia, Austria and the United Kingdom."
History,"The Republic of Letters was the sum of a number of Enlightenment ideals: an egalitarian realm governed by knowledge that could act across political boundaries and rival state power. It was a forum that supported ""free public examination of questions regarding religion or legislation"". Immanuel Kant considered written communication essential to his conception of the public sphere; once everyone was a part of the ""reading public"", then society could be said to be enlightened. The people who participated in the Republic of Letters, such as Diderot and Voltaire, are frequently known today as important Enlightenment figures. Indeed, the men who wrote Diderot's EncyclopÃ©die arguably formed a microcosm of the larger ""republic""."
History,"Maintaining the household was the main duty of samurai women. This was especially crucial during early feudal Japan, when warrior husbands were often traveling abroad or engaged in clan battles. The wife, or okugatasama (meaning: one who remains in the home), was left to manage all household affairs, care for the children, and perhaps even defend the home forcibly. For this reason, many women of the samurai class were trained in wielding a polearm called a naginata or a special knife called the kaiken in an art called tantojutsu (lit. the skill of the knife), which they could use to protect their household, family, and honor if the need arose."
History,"On 27 June 1950, two days after the KPA invaded and three months before the Chinese entered the war, President Truman dispatched the United States Seventh Fleet to the Taiwan Strait, to prevent hostilities between the Nationalist Republic of China (Taiwan) and the People's Republic of China (PRC). On 4 August 1950, with the PRC invasion of Taiwan aborted, Mao Zedong reported to the Politburo that he would intervene in Korea when the People's Liberation Army's (PLA) Taiwan invasion force was reorganized into the PLA North East Frontier Force. China justified its entry into the war as a response to ""American aggression in the guise of the UN""."
History,"The Kabul Shahi dynasties ruled the Kabul Valley and Gandhara (modern-day Pakistan and Afghanistan) from the decline of the Kushan Empire in the 3rd century to the early 9th century. The Shahis are generally split up into two eras: the Buddhist Shahis and the Hindu Shahis, with the change-over thought to have occurred sometime around 870."
History,"When he became First Consul and later Emperor, Napoleon eschewed his general's uniform and habitually wore the simple green colonel uniform (non-Hussar) of a colonel of the Chasseur."
History,"The Atlantic and northern shores were harassed by the Vikings, who also raided the British Isles and settled there as well as in Iceland. In 911, the Viking chieftain Rollo (d. c. 931) received permission from the Frankish King Charles the Simple to settle in what became Normandy."
Philosophy,"According to philosophical materialism, mind and consciousness are by-products or epiphenomena of material processes (such as the biochemistry of the human brain and nervous system), without which they cannot exist. This concept directly contrasts with idealism, where mind and consciousness are first-order realities to which matter is dependent while material interactions are secondary."
Philosophy,"Philosophical empiricists hold no knowledge to be properly inferred or deduced unless it is derived from one's sense-based experience. This view is commonly contrasted with rationalism, which states that knowledge may be derived from reason independently of the senses. For example, John Locke held that some knowledge (e.g. knowledge of God's existence) could be arrived at through intuition and reasoning alone. Similarly Robert Boyle, a prominent advocate of the experimental method, held that we have innate ideas. The main continental rationalists (Descartes, Spinoza, and Leibniz) were also advocates of the empirical ""scientific method""."
Philosophy,"In philosophy, idealism is the group of philosophies which assert that reality, or reality as we can know it, is fundamentally mental, mentally constructed, or otherwise immaterial. Epistemologically, idealism manifests as a skepticism about the possibility of knowing any mind-independent thing. In a sociological sense, idealism emphasizes how human ideas especially beliefs and values shape society. As an ontological doctrine, idealism goes further, asserting that all entities are composed of mind or spirit. Idealism thus rejects physicalist and dualist theories that fail to ascribe priority to the mind."
Philosophy,"In this paper McTaggart proposes two ""temporal series"". The first series, which means to account for our intuitions about temporal becoming, or the moving Now, is called the A-series. The A-series orders events according to their being in the past, present or future, simpliciter and in comparison to each other. The B-series eliminates all reference to the present, and the associated temporal modalities of past and future, and orders all events by the temporal relations earlier than and later than."
Philosophy,"Bragg asked Roy Wood Sellars to draft a document based on this information which resulted in the publication of the Humanist Manifesto in 1933. Potter's book and the Manifesto became the cornerstones of modern humanism, the latter declaring a new religion by saying, ""any religion that can hope to be a synthesising and dynamic force for today must be shaped for the needs of this age. To establish such a religion is a major necessity of the present."" It then presented 15 theses of humanism as foundational principles for this new religion."
